X1,Thai_name,Thai_script,English_name,Image,Region,Description,Description2,major_grouping,minor_grouping
0,Jok,โจ๊ก,Rice,,,"['Of Chinese origin, it is a rice congee with minced chicken or pork. Mixing an egg in with the congee is optional.\n']","Of Chinese origin, it is a rice congee with minced chicken or pork. Mixing an egg in with the congee is optional.",Individual dishes,Rice dishes
1,Khao kan chin,ข้าวกั๊นจิ๊น,,,North,"['A dish of the Tai Yai (', 'Shan people', ') of ', 'Myanmar', ' and northern Thailand, it is rice that is mixed with pork blood and steamed inside a banana leaf. ', 'Khao kan chin', ' is served with cucumber, onions and fried, dried chili peppers.\n']","A dish of the Tai Yai ( Shan people ) of  Myanmar  and northern Thailand, it is rice that is mixed with pork blood and steamed inside a banana leaf.  Khao kan chin  is served with cucumber, onions and fried, dried chili peppers.",Individual dishes,Rice dishes
2,Khao kha mu,ข้าวขาหมู,Braised pork leg on rice,,,"['Steamed rice', ' is served with sliced ', ""pig's trotters"", ', which has been simmered in ', 'soy sauce', ' and ', 'five spice powder', '. It is always served with a sweet spicy dipping sauce, fresh ', ""bird's eye chili"", ' peppers and cloves of garlic on the side. Boiled egg and a clear broth on the side are optional.\n']","Steamed rice  is served with sliced  pig's trotters , which has been simmered in  soy sauce  and  five spice powder . It is always served with a sweet spicy dipping sauce, fresh  bird's eye chili  peppers and cloves of garlic on the side. Boiled egg and a clear broth on the side are optional.",Individual dishes,Rice dishes
3,Khao khai chiao,ข้าวไข่เจียว,Omelette on rice,,,"['A quick snack or breakfast, it is an omelette with white rice, often eaten with chili sauce and cucumber. The variant shown in the image is ', 'khao khai chiao songkhrueang', ' (', 'Thai', ': ', 'ข้าวไข่เจียวทรงเครื่อง', ') where the omelette is topped with a minced pork and vegetable stir-fry.\n']","A quick snack or breakfast, it is an omelette with white rice, often eaten with chili sauce and cucumber. The variant shown in the image is  khao khai chiao songkhrueang  ( Thai :  ข้าวไข่เจียวทรงเครื่อง ) where the omelette is topped with a minced pork and vegetable stir-fry.",Individual dishes,Rice dishes
4,Khao khluk kapi,ข้าวคลุกกะปิ,Fried rice with shrimp paste,,,"['Rice is fried with ', 'shrimp paste', ' and served with sweet pork, sour mango, fried shrimp, chili peppers, and shallots.\n']","Rice is fried with  shrimp paste  and served with sweet pork, sour mango, fried shrimp, chili peppers, and shallots.",Individual dishes,Rice dishes
5,Khao mok gai,ข้าวหมกไก่,Thai,,,"['The Thai version of a ""chicken biryani"". The name literally means ""rice covered chicken"" and this ', 'Thai-Muslim', ' dish is made by cooking rice together with the chicken curry.\n']","The Thai version of a ""chicken biryani"". The name literally means ""rice covered chicken"" and this  Thai-Muslim  dish is made by cooking rice together with the chicken curry.",Individual dishes,Rice dishes
6,Khao mok nuea,ข้าวหมกเนื้อ,Thai beef biryani,,,"['The Thai version of a ""beef biryani"".\n']","The Thai version of a ""beef biryani"".",Individual dishes,Rice dishes
7,Khao man gai,ข้าวมันไก่,Chicken rice,,,"['Rice steamed with garlic served with sliced chicken, chicken broth, and a spicy dipping sauce. This is a Thai version of a dish called Wenchang chicken (文昌雞) from ', 'Hainan', ' in southern China.\n']","Rice steamed with garlic served with sliced chicken, chicken broth, and a spicy dipping sauce. This is a Thai version of a dish called Wenchang chicken (文昌雞) from  Hainan  in southern China.",Individual dishes,Rice dishes
8,Khao mu krop,ข้าวหมูกรอบ,Crispy pork on rice,,,"['Rice and crispy pork that is often, as here in this image, served with boiled egg and a bowl of broth. The sauce that always comes with ', 'khao mu krop', ' is here served separately in the bowl at the top of the image.\n']","Rice and crispy pork that is often, as here in this image, served with boiled egg and a bowl of broth. The sauce that always comes with  khao mu krop  is here served separately in the bowl at the top of the image.",Individual dishes,Rice dishes
9,Khao mu krop mu aeng,ข้าวหมูกรอบหมูแดง,Mixed cispy pork and red roast pork on rice,,,"['Slices of ', 'mu krop', ' (crispy pork) and ', 'mu daeng', ' (', 'red roast pork', ') served on rice, and often covered with a sticky soy and/or oyster-sauce based sauce. Very often, a clear soup, boiled egg, cucumber, and spring onion is served on the side. Sliced chili peppers in Chinese black vinegar and dark soy sauce are provided as a condiment for this dish.\n']","Slices of  mu krop  (crispy pork) and  mu daeng  ( red roast pork ) served on rice, and often covered with a sticky soy and/or oyster-sauce based sauce. Very often, a clear soup, boiled egg, cucumber, and spring onion is served on the side. Sliced chili peppers in Chinese black vinegar and dark soy sauce are provided as a condiment for this dish.",Individual dishes,Rice dishes
10,Khao na pet,ข้าวหน้าเป็ด,Red roast duck on rice,,,['Boiled rice with roast duck and duck broth on the side. It is served with sliced chili peppers in soy sauce as a condiment.\n'],Boiled rice with roast duck and duck broth on the side. It is served with sliced chili peppers in soy sauce as a condiment.,Individual dishes,Rice dishes
11,Khao niao,ข้าวเหนียว,Glutinous,,,['Khao niao is traditionally eaten using only the right hand. It is the staple food of Northern and Northeastern Thais.\n'],Khao niao is traditionally eaten using only the right hand. It is the staple food of Northern and Northeastern Thais.,Individual dishes,Rice dishes
12,Khao nuea op,ข้าวเนื้ออบ,,,,"['Rice with slices of baked beef, served with a spicy chili dip.\n']","Rice with slices of baked beef, served with a spicy chili dip.",Individual dishes,Rice dishes
13,Khao phat,ข้าวผัด,Thai fried rice,,,"['Fried rice in Thailand can be made with different ingredients. Customarily served with fresh lime, cucumber, spring onions, and ', 'nam pla phrik', ' (chili peppers in fish sauce).\n']","Fried rice in Thailand can be made with different ingredients. Customarily served with fresh lime, cucumber, spring onions, and  nam pla phrik  (chili peppers in fish sauce).",Individual dishes,Rice dishes
14,Khao phat amerikan,ข้าวผัดอเมริกัน,American fried rice,,,"['American fried rice', ' is rice fried with onion, tomato, raisins, and flavored with ketchup. It is often garnished with some sausage, fried chicken, and egg.\n']","American fried rice  is rice fried with onion, tomato, raisins, and flavored with ketchup. It is often garnished with some sausage, fried chicken, and egg.",Individual dishes,Rice dishes
15,Khao phat kaeng khiao wan,ข้าวผัดแกงเขียวหวาน,,,,['Rice fried with green curry.\n'],Rice fried with green curry.,Individual dishes,Rice dishes
16,Khao phat kaphrao mu,ข้าวผัดกะเพราหมู,Basil fried rice with pork,,,"['Rice fried with a certain variety of Thai basil called ', 'kaphrao', ' (', 'Ocimum tenuiflorum', '), sliced pork, and chili peppers.\n']","Rice fried with a certain variety of Thai basil called  kaphrao  ( Ocimum tenuiflorum ), sliced pork, and chili peppers.",Individual dishes,Rice dishes
17,Khao phat namliap,ข้าวผัดหนำเลี้ยบ,,,,"['Rice fried with ', 'nam liap', ', the fruit of the ', 'Canarium album', ', also known as ""Chinese olives"".\n']","Rice fried with  nam liap , the fruit of the  Canarium album , also known as ""Chinese olives"".",Individual dishes,Rice dishes
18,Khao phat nam phrik long ruea,ข้าวผัดน้ำพริกลงเรือ,,,Central,"['Rice fried with ', 'Nam phrik long ruea', ' (lit. ""boat journey chili paste"") and pieces of ', 'khai khem', "" (salted duck's eggs). Fried, sliced, sweet Chinese sausage called "", 'kun chiang', ' (', 'Thai', ': ', 'กุนเชียง', ') are also served here with some sliced cucumber on the side.\n']","Rice fried with  Nam phrik long ruea  (lit. ""boat journey chili paste"") and pieces of  khai khem  (salted duck's eggs). Fried, sliced, sweet Chinese sausage called  kun chiang  ( Thai :  กุนเชียง ) are also served here with some sliced cucumber on the side.",Individual dishes,Rice dishes
19,Khao phat nam phrik narok,ข้าวผัดน้ำพริกนรก,,,,"['The name literally means ""rice fried with chili paste from hell"". The rice is fried with ', 'nam phrik narok', ', a very spicy chili paste made with fried catfish, grilled onion and garlic, grilled (dried) chili peppers, sugar, fish sauce, and shrimp paste. Here it is served with ', 'mu yang', ' (grilled pork) and ', 'nam chim chaeo', ', a spicy dipping sauce.\n']","The name literally means ""rice fried with chili paste from hell"". The rice is fried with  nam phrik narok , a very spicy chili paste made with fried catfish, grilled onion and garlic, grilled (dried) chili peppers, sugar, fish sauce, and shrimp paste. Here it is served with  mu yang  (grilled pork) and  nam chim chaeo , a spicy dipping sauce.",Individual dishes,Rice dishes
20,Khao tom,ข้าวต้ม,Thai rice soup,,,"['Boiled rice in a light broth, usually with minced pork, chicken, or fish. It is often eaten for breakfast.\n']","Boiled rice in a light broth, usually with minced pork, chicken, or fish. It is often eaten for breakfast.",Individual dishes,Rice dishes
21,Khao tom kui,ข้าวต้มกุ๊ย,Plain rice,,,['Plain rice is cooked to a porridge and eaten as the staple together with a variety of side dishes.\n'],Plain rice is cooked to a porridge and eaten as the staple together with a variety of side dishes.,Individual dishes,Rice dishes
0,Bami haeng pet,บะหมี่แห้งเป็ด,"Egg noodles served ""dry"" with duck",,,"['Egg noodles served ""dry"" with slices of braised duck, and often, as shown on the image, together with ""blood tofu"". The broth is served on the side. It is originally a Chinese dish.\n']","Egg noodles served ""dry"" with slices of braised duck, and often, as shown on the image, together with ""blood tofu"". The broth is served on the side. It is originally a Chinese dish.",Individual dishes,Noodle dishes
1,Bami mu daeng,บะหมี่หมูแดง,Egg noodle soup with,,,"['Originally a Chinese dish, it is now common in Thailand. Often served with chili peppers in vinegar, and dried chili flakes. The version shown in the photo also contains ', 'kiao kung', ' (', 'Thai', ': ', 'เกี๊ยวกุ้ง', '; prawn ', 'wontons', ').\n']","Originally a Chinese dish, it is now common in Thailand. Often served with chili peppers in vinegar, and dried chili flakes. The version shown in the photo also contains  kiao kung  ( Thai :  เกี๊ยวกุ้ง ; prawn  wontons ).",Individual dishes,Noodle dishes
2,Khanom chin kaeng khiao wan kai,ขนมจีนแกงเขียวหวานไก่,,,,"['This noodle dish consists of ', 'green chicken curry', ' served over ', 'khanom chin', ', fresh Thai rice noodles. It is usually accompanied by a selection of raw vegetables and herbs on the side. The chicken meat used in this particular version is ', 'chicken feet', '.\n']","This noodle dish consists of  green chicken curry  served over  khanom chin , fresh Thai rice noodles. It is usually accompanied by a selection of raw vegetables and herbs on the side. The chicken meat used in this particular version is  chicken feet .",Individual dishes,Noodle dishes
3,Khanom chin nam ngiao,ขนมจีนน้ำเงี้ยว,,,North,"['A speciality of Northern Thailand, it is Thai fermented rice noodles served with pork or chicken blood tofu in a sauce made with pork broth and tomato, crushed fried dry chili peppers, pork blood, dry fermented soy bean, and dried red kapok flowers.\n']","A speciality of Northern Thailand, it is Thai fermented rice noodles served with pork or chicken blood tofu in a sauce made with pork broth and tomato, crushed fried dry chili peppers, pork blood, dry fermented soy bean, and dried red kapok flowers.",Individual dishes,Noodle dishes
4,Khanom jeen nam yaa,ขนมจีนน้ำยา,,,Central,"['Thai rice noodles served with a fish based sauce called ', 'nam ya', '.\n']",Thai rice noodles served with a fish based sauce called  nam ya .,Individual dishes,Noodle dishes
5,Khanom chin sao nam,ขนมจีนซาวน้ำ,,,Central,"['Cold rice noodles served as a salad with thick coconut milk, finely chopped pineapple, sliced raw garlic and Thai chili peppers, pounded dried prawns, shredded ginger, lime juice, fish sauce, and sugar.\n']","Cold rice noodles served as a salad with thick coconut milk, finely chopped pineapple, sliced raw garlic and Thai chili peppers, pounded dried prawns, shredded ginger, lime juice, fish sauce, and sugar.",Individual dishes,Noodle dishes
6,Khao soi,ข้าวซอย,Northern Thai curry noodles,,North,"['Boiled as well as crispy fried egg noodles (', 'bami', ') are served in a curry soup. The version with chicken is called ', 'khao soi kai', ', with beef it is called ', 'khao soi nuea', '.\n']","Boiled as well as crispy fried egg noodles ( bami ) are served in a curry soup. The version with chicken is called  khao soi kai , with beef it is called  khao soi nuea .",Individual dishes,Noodle dishes
7,Khao soi Mae Sai,ข้าวซอยแม่สาย,,,North,"['Khao soi Mae Sai', ' is the name in ', 'Chiang Mai', ' of a certain type of ', 'khao soi', ' that is more common in ', 'Chiang Rai province', ', in the area along the border with Burma and Laos (', 'Mae Sai', ' is a border town in Chiang Rai province). It is a spicy soup-like dish, similar to the broth used in ', 'khanom chin nam ngiao', ', containing soft, wide rice noodles, pork ribs, congealed pork blood, and minced pork. Tomatoes and fermented soy bean give it its specific taste. Sliced raw cabbage and bean sprouts are served on the side.\n']","Khao soi Mae Sai  is the name in  Chiang Mai  of a certain type of  khao soi  that is more common in  Chiang Rai province , in the area along the border with Burma and Laos ( Mae Sai  is a border town in Chiang Rai province). It is a spicy soup-like dish, similar to the broth used in  khanom chin nam ngiao , containing soft, wide rice noodles, pork ribs, congealed pork blood, and minced pork. Tomatoes and fermented soy bean give it its specific taste. Sliced raw cabbage and bean sprouts are served on the side.",Individual dishes,Noodle dishes
8,Khao soi nam na,ข้าวซอยน้ำหน้า,,,North,"['Somewhat similar to ', 'khao soi Mae Sai', ', this variant from the eastern part of ', 'Chiang Rai Province', ' is made with wide rice noodles in a clear pork broth. A spoonful of ', 'nam phrik ong', ' (a sauce made from minced pork, tomato, fermented soy bean or shrimp paste, and dried chili peppers) is heaped on top of the noodles (', 'nam na', ' literally means ""with sauce on top"").\n']","Somewhat similar to  khao soi Mae Sai , this variant from the eastern part of  Chiang Rai Province  is made with wide rice noodles in a clear pork broth. A spoonful of  nam phrik ong  (a sauce made from minced pork, tomato, fermented soy bean or shrimp paste, and dried chili peppers) is heaped on top of the noodles ( nam na  literally means ""with sauce on top"").",Individual dishes,Noodle dishes
9,Kuaichap,กวยจั๊บ,,,,"['Originally a ', 'Teochew', ' Chinese dish (', 'Chinese', ': ', '粿汁', '), it is a soup of pork broth with rolled up rice noodle sheets (resulting in rolls about the size of Italian penne), pork intestines, ""blood tofu"", and boiled egg.\n']","Originally a  Teochew  Chinese dish ( Chinese :  粿汁 ), it is a soup of pork broth with rolled up rice noodle sheets (resulting in rolls about the size of Italian penne), pork intestines, ""blood tofu"", and boiled egg.",Individual dishes,Noodle dishes
10,Kuai-tiao nam,ก๋วยเตี๋ยวน้ำ,Wide rice noodle soup,,,"['A soup of ', 'wide rice noodles', ', often with minced pork, ', 'pork balls', ' or ', 'fish balls', '.\n']","A soup of  wide rice noodles , often with minced pork,  pork balls  or  fish balls .",Individual dishes,Noodle dishes
11,Kuai-tiao nuea pueai,ก๋วยเตี๋ยวเนื้อเปื่อย,,,,"['A beef noodle soup with slices of very tender beef (', 'nuea pueay', ').\n']",A beef noodle soup with slices of very tender beef ( nuea pueay ).,Individual dishes,Noodle dishes
12,Kuai-tiao phat khi mao,ก๋วยเตี๋ยวผัดขี้เมา,Drunken noodles,,,['Spicy fried wide rice noodles.\n'],Spicy fried wide rice noodles.,Individual dishes,Noodle dishes
13,Kuai-tiao rat na,ก๋วยเตี๋ยวราดหน้า,Wide rice noodles in gravy,,Central,"['Fried ', 'wide rice noodles', ' with beef, pork, chicken, or seafood in a thickened gravy.\n']","Fried  wide rice noodles  with beef, pork, chicken, or seafood in a thickened gravy.",Individual dishes,Noodle dishes
14,Kuai-tiao ruea,ก๋วยเตี๋ยวเรือ,Boat noodles,,Central,"['Rice noodles with beef or pork (and sometimes offal) in a brown broth which contains ', 'cinnamon', ', ', 'star anise', ' and sometimes blood. It is spicy and sour.\n']","Rice noodles with beef or pork (and sometimes offal) in a brown broth which contains  cinnamon ,  star anise  and sometimes blood. It is spicy and sour.",Individual dishes,Noodle dishes
15,Mi krop,[หมี่กรอบ,Thai crispy fried noodles,,,['Deep fried rice vermicelli with a sweet and sour sauce.\n'],Deep fried rice vermicelli with a sweet and sour sauce.,Individual dishes,Noodle dishes
16,Phat Mama,ผัดมาม่า,,,,"['Mama', ' (', 'Thai', ': ', 'มาม่า', ') is the most popular brand of instant noodles in Thailand and the brand name is commonly used, instead of the generic ', 'bami kueng samret rup', ' (', 'Thai', ': ', 'บะหมี่กึ่งสำเร็จรูป', '), to designate instant noodles. The particular version in the image has been stir-fried ""', 'drunken noodle', '""-style.\n']","Mama  ( Thai :  มาม่า ) is the most popular brand of instant noodles in Thailand and the brand name is commonly used, instead of the generic  bami kueng samret rup  ( Thai :  บะหมี่กึ่งสำเร็จรูป ), to designate instant noodles. The particular version in the image has been stir-fried "" drunken noodle ""-style.",Individual dishes,Noodle dishes
17,Phat si-io,ผัดซีอิ๊ว,Noodles stir-fried with soy sauce,,,"['Usually wide rice noodles fried with chicken or pork, and soy sauce.\n']","Usually wide rice noodles fried with chicken or pork, and soy sauce.",Individual dishes,Noodle dishes
18,Phat Thai,ผัดไทย,Pad Thai,,,"['Stir fried medium size rice noodles (', 'sen lek', ') with fish sauce, sugar, lime juice or tamarind pulp, ground peanuts, egg, bean sprouts, and ', 'Chinese chives', ' (', 'kuichai', '), combined with pork, chicken, seafood, or tofu.\n']","Stir fried medium size rice noodles ( sen lek ) with fish sauce, sugar, lime juice or tamarind pulp, ground peanuts, egg, bean sprouts, and  Chinese chives  ( kuichai ), combined with pork, chicken, seafood, or tofu.",Individual dishes,Noodle dishes
19,Phat wun sen,ผัดวุ้นเส้น,Stir-fried,,,"['Glass noodles are stir-fried with egg and vegetables, and a variety of ingredients such as meat, seafood, or with vegetarian alternatives.\n']","Glass noodles are stir-fried with egg and vegetables, and a variety of ingredients such as meat, seafood, or with vegetarian alternatives.",Individual dishes,Noodle dishes
20,Sapaketti phat khi mao,สปาเกตตีผัดขี้เมา,,,,"['A Thai ', 'fusion dish', ' where the name literally means spaghetti fried ""shit-drunk"" (', 'khi mao', ' = extremely drunk). An explanation is that any dish fried this way is easy to make, spicy, and uses whatever ingredients are available at that time; great after a night out drinking when still hungry.\n']","A Thai  fusion dish  where the name literally means spaghetti fried ""shit-drunk"" ( khi mao  = extremely drunk). An explanation is that any dish fried this way is easy to make, spicy, and uses whatever ingredients are available at that time; great after a night out drinking when still hungry.",Individual dishes,Noodle dishes
21,Tom yam boran,ต้มยำโบราณ,,,Central,"['Tom yam boran', ' is noodles served in a thick spicy sour sauce or broth, with crushed dried chili peppers, chopped peanuts, and blanched vegetables such as bean sprouts. This version is ', 'bami mu tom yam boran', ': with egg noodles and pork.\n']","Tom yam boran  is noodles served in a thick spicy sour sauce or broth, with crushed dried chili peppers, chopped peanuts, and blanched vegetables such as bean sprouts. This version is  bami mu tom yam boran : with egg noodles and pork.",Individual dishes,Noodle dishes
22,Yentafo,เย็นตาโฟ,,,,"['The Thai version of the Chinese noodle dish ', 'Yong Tau Foo', ' is slightly sweet, sour, salty, and spicy.\n']","The Thai version of the Chinese noodle dish  Yong Tau Foo  is slightly sweet, sour, salty, and spicy.",Individual dishes,Noodle dishes
23,Yum kanom jeen,ยำขนมจีน,,,,"['Yum kanomjeen is a spicy and sour salad mixed with kanom jeen. Kanom jeen is thin rice noodles which are made from fresh rice sometimes fermented rice starch, fermented for few days, boiled and then made into noodles. The original kanom jeen came from the Mon people. The main ingredients of Yum kanom jeen are fish sauce, sugar, lime juice, and chili powder. Some places will add pla ra to Yum kanom jeen too. Pla ra is the Thai traditional ingredient produced by fermented fish. Yum kanom jeen has a good spicy and sour taste, but many people would like to order the flavor that they like. Yum kanom jeen is a low- calorie food and it has only 220 calories per dish. To suit for people who are healthy and want to diet. Yum kanom jeen is not difficult to find. It can be found in either restaurant or street food.\n']","Yum kanomjeen is a spicy and sour salad mixed with kanom jeen. Kanom jeen is thin rice noodles which are made from fresh rice sometimes fermented rice starch, fermented for few days, boiled and then made into noodles. The original kanom jeen came from the Mon people. The main ingredients of Yum kanom jeen are fish sauce, sugar, lime juice, and chili powder. Some places will add pla ra to Yum kanom jeen too. Pla ra is the Thai traditional ingredient produced by fermented fish. Yum kanom jeen has a good spicy and sour taste, but many people would like to order the flavor that they like. Yum kanom jeen is a low- calorie food and it has only 220 calories per dish. To suit for people who are healthy and want to diet. Yum kanom jeen is not difficult to find. It can be found in either restaurant or street food.",Individual dishes,Noodle dishes
0,Chim chum,จิ้มจุ่ม,,,,"['A Thai style hot pot served in an ', 'earthenware', ' pot where the ingredients (meats, vegetables, mushrooms, noodles) are cooked in a clear herb broth of lemongrass, galangal, and ', 'kaffir lime', ' leaves. Additionally, the broth can contain other herbs such as ', 'kaphrao', ' (', 'Thai holy basil', '), spices such as chillies, or in addition be partially meat based, using pork ribs for instance as one of the base ingredients. It is served with one or more ', 'nam chim', ' (dipping sauces).\n']","A Thai style hot pot served in an  earthenware  pot where the ingredients (meats, vegetables, mushrooms, noodles) are cooked in a clear herb broth of lemongrass, galangal, and  kaffir lime  leaves. Additionally, the broth can contain other herbs such as  kaphrao  ( Thai holy basil ), spices such as chillies, or in addition be partially meat based, using pork ribs for instance as one of the base ingredients. It is served with one or more  nam chim  (dipping sauces).",Individual dishes,Misc Indiv
1,Kaolao,เกาเหลา,,,,"['A soup of Chinese origin, usually containing offal, often pork liver and intestines, also boiled eggs, and other meats such as crispy pork. Alternatively, at regular noodle soup shops, it can also be as a regular Thai-Chinese noodle soup but then served without any noodles.\n']","A soup of Chinese origin, usually containing offal, often pork liver and intestines, also boiled eggs, and other meats such as crispy pork. Alternatively, at regular noodle soup shops, it can also be as a regular Thai-Chinese noodle soup but then served without any noodles.",Individual dishes,Misc Indiv
2,Khao soi noi songkhrueang,ข้าวซอยน้อยทรงเครื่อง,,,,"['Colloquially also known as ', 'pizza doi', ' (Thai: พิซซาดอย, literally: ""mountain pizza""). This is a dish of ', 'Shan people', '. This version uses steamed egg and vegetables as the filling for the steamed rice wrap. The whole is dusted with crushed peanuts.\n']","Colloquially also known as  pizza doi  (Thai: พิซซาดอย, literally: ""mountain pizza""). This is a dish of  Shan people . This version uses steamed egg and vegetables as the filling for the steamed rice wrap. The whole is dusted with crushed peanuts.",Individual dishes,Misc Indiv
