X1,Thai_name,Thai_script,English_name,Image,Region,Description,Description2,major_grouping,minor_grouping
4,Tom khlong,ต้มโคล้ง,,,,"['It is a spicy and sour soup somewhat similar to Tom yam. The sourness however does not derive from lime juice but through the use of tamarind juice. The version in the image contains fried smoked fish, tomato, and mushrooms.\n']","It is a spicy and sour soup somewhat similar to Tom yam. The sourness however does not derive from lime juice but through the use of tamarind juice. The version in the image contains fried smoked fish, tomato, and mushrooms.",Shared dishes,Soups
5,Tom mara,ต้มมะระ,Bitter melon soup,,,"['A clear soup made with ', 'bitter melon', ' (also known as bitter gourd; ', 'Momordica charantia', ') of Chinese origin. It is often stuffed with minced pork or with minced pork mixed with glass noodles as on this image. The full name of the latter version would then be ', 'tom mara yat sai mu sap wunsen', '.\n']",A clear soup made with  bitter melon  (also known as bitter gourd;  Momordica charantia ) of Chinese origin. It is often stuffed with minced pork or with minced pork mixed with glass noodles as on this image. The full name of the latter version would then be  tom mara yat sai mu sap wunsen .,Shared dishes,Soups
6,Tom phak kat dong mu,ต้มผักกาดดองหมู,,,,"['A soup of boiled ', 'pickled', ' Chinese cabbage and pork ribs. This dish is Chinese in origin.\n']",A soup of boiled  pickled  Chinese cabbage and pork ribs. This dish is Chinese in origin.,Shared dishes,Soups
7,Tom saep,ต้มแซ่บ,Hot and sour Isan soup,,Northeast,"['A spicy soup made with stewed meat (usually pork, chicken or beef), roasted fresh herbs and spices, ground roasted rice, and generous amounts of lime juice and fresh herbs just before serving.\n']","A spicy soup made with stewed meat (usually pork, chicken or beef), roasted fresh herbs and spices, ground roasted rice, and generous amounts of lime juice and fresh herbs just before serving.",Shared dishes,Soups
8,Tom som kraduk mu,ต้มส้มกระดูกหมู,,,,"['Tom som', ' translates to ""sour soup"". This particular version is a basic one with only pork ribs (', 'kraduk mu', ') and it derives its sourness from lime juice. Other types of ', 'tom som', ' can also use tamarind for acidity, or a combination of both lime and tamarind, and can be made from a multitude of ingredients: meats as well as seafood, and vegetables.\n']","Tom som  translates to ""sour soup"". This particular version is a basic one with only pork ribs ( kraduk mu ) and it derives its sourness from lime juice. Other types of  tom som  can also use tamarind for acidity, or a combination of both lime and tamarind, and can be made from a multitude of ingredients: meats as well as seafood, and vegetables.",Shared dishes,Soups
9,Tom yam,ต้มยำ,Tom yum soup,,Central,"['A hot and sour broth made from ', 'lemon grass', ', ', 'galangal', ', ', 'kaffir lime', ' leaves, dried chili peppers, and lime juice, usually with prawns (', 'Tom yam kung', ') or chicken (', 'Tom yam kai', ').', '[1]', '\n']","A hot and sour broth made from  lemon grass ,  galangal ,  kaffir lime  leaves, dried chili peppers, and lime juice, usually with prawns ( Tom yam kung ) or chicken ( Tom yam kai ). [1] ",Shared dishes,Soups
10,Tom yuea phai,ต้มเยื่อไผ่,,,,"['It is a clear broth with, amongst other ingredients, ', 'yuea phai', ' (""bamboo fungus""; ', 'Phallus indusiatus', ')\n']","It is a clear broth with, amongst other ingredients,  yuea phai  (""bamboo fungus"";  Phallus indusiatus )",Shared dishes,Soups
0,Khao yam,ข้าวยำ,,,South,"['A type of Thai rice salad. Here it is shown unmixed, as served at a southern Thai eatery in Korat. This particular version used pomelo, bean sprouts, lime leaves, and toasted coconut flakes, and dried shrimp flakes with the rice.\n']","A type of Thai rice salad. Here it is shown unmixed, as served at a southern Thai eatery in Korat. This particular version used pomelo, bean sprouts, lime leaves, and toasted coconut flakes, and dried shrimp flakes with the rice.",Shared dishes,Salads
1,Koi pla,ก้อยปลา,,,Northeast,"['Minced or finely chopped raw fish in spicy salad dressing. It is a popular raw fish dish in ', 'Isan', ' and a common source of infection with ', 'Opisthorchis viverrini', ' (Southeast Asian ', 'liver fluke', ').\n']",Minced or finely chopped raw fish in spicy salad dressing. It is a popular raw fish dish in  Isan  and a common source of infection with  Opisthorchis viverrini  (Southeast Asian  liver fluke ).,Shared dishes,Salads
2,Kung chae nampla,กุ้งแช่น้ำปลา,,,,"['A Thai salad made from fresh raw shrimp soaked in Thai fish sauce and served with sliced ', 'bitter gourd', ', mint, and a spicy sauce made with raw garlic, chillies, lime juice, sugar, and fresh cilantro/coriander.\n']","A Thai salad made from fresh raw shrimp soaked in Thai fish sauce and served with sliced  bitter gourd , mint, and a spicy sauce made with raw garlic, chillies, lime juice, sugar, and fresh cilantro/coriander.",Shared dishes,Salads
3,Kung ten,กุ้งเต้น,Dancing shrimp,,Northeast,"['A yam-style salad made with raw, and often still alive and ""dancing"", ', 'freshwater shrimp', '. Shrimp of the species ', 'Macrobrachium', ' lanchesteri', ' are often used.', '[2]', '\n']","A yam-style salad made with raw, and often still alive and ""dancing"",  freshwater shrimp . Shrimp of the species  Macrobrachium  lanchesteri  are often used. [2] ",Shared dishes,Salads
4,Lap Isan,ลาบอีสาน,Larb,,Northeast,"['Northeastern style ', 'lap', ' is a spicy and sour salad of minced raw or cooked meat (mainly pork, chicken or duck), shallots or onions, lime juice, fish sauce, chillies, ground roasted rice and mint.\n']","Northeastern style  lap  is a spicy and sour salad of minced raw or cooked meat (mainly pork, chicken or duck), shallots or onions, lime juice, fish sauce, chillies, ground roasted rice and mint.",Shared dishes,Salads
5,Lap Lanna,ลาบล้านนา,,,North,"['Northern Thai ', 'lap', ' is completely different from ', 'lap', ' from northeastern Thailand. Northern Thai ', 'lap', ' is made by mixing raw or cooked minced meat (mainly pork, beef, chicken or fish) with an elaborate mix of dry ', 'spices', ' and herbs. The northern Thai ', 'lap', ' does not contain lime juice or fish sauce. The version in the image is ', 'lap khua', ', meaning that the meat has been fried.\n']","Northern Thai  lap  is completely different from  lap  from northeastern Thailand. Northern Thai  lap  is made by mixing raw or cooked minced meat (mainly pork, beef, chicken or fish) with an elaborate mix of dry  spices  and herbs. The northern Thai  lap  does not contain lime juice or fish sauce. The version in the image is  lap khua , meaning that the meat has been fried.",Shared dishes,Salads
6,Lap nuea dip,ลาบเนื้อดิบ,,,North,"['A northern Thai ', 'lap', '-style salad of sliced raw beef (the version in the image also shows slices of raw beef ', 'tripe', ') and ground, dried spices.\n']","A northern Thai  lap -style salad of sliced raw beef (the version in the image also shows slices of raw beef  tripe ) and ground, dried spices.",Shared dishes,Salads
7,Mu nam tok,หมูน้ำตก,,,Northeast,"['A very spicy salad made with pork (', 'mu', ') and somewhat identical to ', 'lap', ', except that the meat is cut into thin strips rather than minced.\n']","A very spicy salad made with pork ( mu ) and somewhat identical to  lap , except that the meat is cut into thin strips rather than minced.",Shared dishes,Salads
8,Naem khluk,แหนมคลุก,,,,"['Naem sausage', ' (pork fermented with sticky rice)', '[3]', ' is mixed with boiled rice and then deep-fried. The salad is made by crumbling the deep-fried balls and mixing in sliced shallots, dried chillies, fish sauce and lime juice. It is served with raw vegetables and herbs.\n']","Naem sausage  (pork fermented with sticky rice) [3]  is mixed with boiled rice and then deep-fried. The salad is made by crumbling the deep-fried balls and mixing in sliced shallots, dried chillies, fish sauce and lime juice. It is served with raw vegetables and herbs.",Shared dishes,Salads
9,Nuea yang nam tok,เนื้อย่างน้ำตก,,,Northeast,"['With a similar ""dressing"" as ', 'larb', ', this dish is made with sliced grilled beef. ', '""Nam tok""', ' means ""waterfall"" in Thai and it is thought that the meat juices should run out from the meat like a waterfall.\n']","With a similar ""dressing"" as  larb , this dish is made with sliced grilled beef.  ""Nam tok""  means ""waterfall"" in Thai and it is thought that the meat juices should run out from the meat like a waterfall.",Shared dishes,Salads
10,Phla kung,พล่ากุ้ง,,,,"['A spicy salad of prawns, sliced lemongrass, ', 'culantro', ' and/or other herbs, and ', 'shallots', ', with a dressing of lime juice, sweet chilli paste (', 'Nam phrik phao', ' – optional), fish sauce, pounded garlic and ', ""bird's eye chili"", '. The version shown in the image also contained minced pork.\n']","A spicy salad of prawns, sliced lemongrass,  culantro  and/or other herbs, and  shallots , with a dressing of lime juice, sweet chilli paste ( Nam phrik phao  – optional), fish sauce, pounded garlic and  bird's eye chili . The version shown in the image also contained minced pork.",Shared dishes,Salads
11,Phla mu,พล่าหมู,,,,"['A spicy salad of sliced grilled pork, sliced lemongrass, mint, ', 'culantro', ' (optional) and ', 'shallots', ', with a dressing of lime juice, sweet chilli paste (', 'Nam phrik phao', ' – optional), fish sauce, pounded garlic and ', ""bird's eye chili"", '.\n']","A spicy salad of sliced grilled pork, sliced lemongrass, mint,  culantro  (optional) and  shallots , with a dressing of lime juice, sweet chilli paste ( Nam phrik phao  – optional), fish sauce, pounded garlic and  bird's eye chili .",Shared dishes,Salads
12,Phla nuea makhuea on,พล่าเนื้อมะเขืออ่อน,,,,"['A Thai salad made with medium rare beef and Thai aubergines. The sliced, raw eggplants are mixed in with the warm beef to soften them (', 'makhuea on', ' means ""soft aubergine""). This particular version of the salad was served with a ', 'nam tok', '-style dressing.\n']","A Thai salad made with medium rare beef and Thai aubergines. The sliced, raw eggplants are mixed in with the warm beef to soften them ( makhuea on  means ""soft aubergine""). This particular version of the salad was served with a  nam tok -style dressing.",Shared dishes,Salads
13,Sa nuea,ส้าเนื้อ,,,North,"['A northern Thai speciality, made with blanched medium rare, thinly sliced beef. Other ingredients for this dish are the elaborate ', 'phrik lap Lanna', ' spices-and-chilli mix, onions, some broth, and fresh herbs.\n']","A northern Thai speciality, made with blanched medium rare, thinly sliced beef. Other ingredients for this dish are the elaborate  phrik lap Lanna  spices-and-chilli mix, onions, some broth, and fresh herbs.",Shared dishes,Salads
14,Sa nuea sadung,ส้าเนื้อสะดุ้ง,,,North,"['A northern Thai speciality, made with sauteed medium rare, thinly sliced beef. Other ingredients for this dish are the elaborate ', 'phrik lap Lanna', ' spices-and-chilli mix, onions, some broth, and fresh herbs such as ', 'kraphao', ' (holy basil) or ', 'phak phai', ' (', 'Vietnamese coriander', ') although this particular version was made using ', 'saranae', ' (', 'spearmint', '). This particular version also contained ', 'nam phia', ', the partially digested contents from the first of the four stomachs of cattle, for added flavour.', '[4]', '\n']","A northern Thai speciality, made with sauteed medium rare, thinly sliced beef. Other ingredients for this dish are the elaborate  phrik lap Lanna  spices-and-chilli mix, onions, some broth, and fresh herbs such as  kraphao  (holy basil) or  phak phai  ( Vietnamese coriander ) although this particular version was made using  saranae  ( spearmint ). This particular version also contained  nam phia , the partially digested contents from the first of the four stomachs of cattle, for added flavour. [4] ",Shared dishes,Salads
15,Som tam khai khem,ส้มตำไข่เค็ม,,,,"['A variation of the standard papaya ', 'som tam', ' with salted eggs.\n']",A variation of the standard papaya  som tam  with salted eggs.,Shared dishes,Salads
16,Som tam pla ra,ส้มตำปลาร้า,,,Northeast,"['Regarded as the original ', 'som tam', ', this version of green papaya salad contains ', 'pla ra', ' (a sauce of fermented fish), and very often also brined rice paddy crabs, and ', 'makok', ' (the fruit of the ', 'Spondias mombin', ') besides the usual ingredients for ', 'som tam', '. It does not however contain peanuts. It is also known as ', 'som tam Lao', ' or, for short, as just ', 'tam Lao', ' after the ', 'Lao people', ' of ', 'Laos', ' and of the ', 'Isan', ' region of Thailand.\n']","Regarded as the original  som tam , this version of green papaya salad contains  pla ra  (a sauce of fermented fish), and very often also brined rice paddy crabs, and  makok  (the fruit of the  Spondias mombin ) besides the usual ingredients for  som tam . It does not however contain peanuts. It is also known as  som tam Lao  or, for short, as just  tam Lao  after the  Lao people  of  Laos  and of the  Isan  region of Thailand.",Shared dishes,Salads
17,Som tam pu,ส้มตำปู,,,,"['Green papaya salad', ' with brined rice paddy crabs.\n']",Green papaya salad  with brined rice paddy crabs.,Shared dishes,Salads
18,Som tam Thai,ส้มตำไทย,Thai papaya salad,,Central,"['Som tam Thai', ' with peanuts, dried shrimp and palm sugar, is the central Thai variant of green papaya salad.\n']","Som tam Thai  with peanuts, dried shrimp and palm sugar, is the central Thai variant of green papaya salad.",Shared dishes,Salads
19,Tam khanun,ตำขนุน,,,North,"['A spicy Northern Thai salad made with boiled green whole ', 'jackfruit', ' which has been mashed with a mortar and pestle, and minced pork. It is normally eaten with sticky rice and (as seen on the image) with ', 'khaep mu', ' (pork cracklings).\n']","A spicy Northern Thai salad made with boiled green whole  jackfruit  which has been mashed with a mortar and pestle, and minced pork. It is normally eaten with sticky rice and (as seen on the image) with  khaep mu  (pork cracklings).",Shared dishes,Salads
20,Tam makhuea,ตำมะเขือ,,,North,"['Chopped and then pounded grilled long green eggplant (', 'makhuea yao', '; ', 'Thai', ': ', 'มะเขือยาว', ""), grilled green chili peppers, raw garlic and salt put in a banana leaf package mixed together with hard-boiled egg. It's a speciality of Northern Thailand where it is traditionally eaten with "", 'sticky rice', '.\n']","Chopped and then pounded grilled long green eggplant ( makhuea yao ;  Thai :  มะเขือยาว ), grilled green chili peppers, raw garlic and salt put in a banana leaf package mixed together with hard-boiled egg. It's a speciality of Northern Thailand where it is traditionally eaten with  sticky rice .",Shared dishes,Salads
21,Tam mamuang,ตำมะม่วง,,,,"['A ', 'som tam', ' style salad with tangy unripe ', 'mango', ' ""au Julienne"" as its main ingredient. The version in the image contains ', 'pla haeng thot', ', deep-fried sun-dried anchovies.\n']","A  som tam  style salad with tangy unripe  mango  ""au Julienne"" as its main ingredient. The version in the image contains  pla haeng thot , deep-fried sun-dried anchovies.",Shared dishes,Salads
22,Tam maphrao on sen mi krop,ตำมะพร้าวอ่อนเส้นหมี่กรอบ,,,,"['A ', 'som tam', ' style salad made with the meat of a young coconut and served with crispy deep-fried thin Chinese rice noodles.\n']",A  som tam  style salad made with the meat of a young coconut and served with crispy deep-fried thin Chinese rice noodles.,Shared dishes,Salads
23,Tam mu yo,ตำหมูยอ,,,,"['A spicy Thai salad made with ', 'mu yo', ', a Thai pork sausage which is often also described in Thailand as ""Vietnamese sausage"". The dressing is somewhat similar to that of ', 'som tam', '.\n']","A spicy Thai salad made with  mu yo , a Thai pork sausage which is often also described in Thailand as ""Vietnamese sausage"". The dressing is somewhat similar to that of  som tam .",Shared dishes,Salads
24,Tam phonlamai ruam,ตำผลไม้รวม,,,,"['The fruits used in this particular salad show the fusion aspect of Thai cuisine, as it incorporates ""modern"" (for Thais) fruit such as apples and grapes besides traditional fruit such as pineapple and guava. The dressing is made with pounded garlic, sugar, chili peppers, dried shrimp, lime juice and fish sauce, and is similar to that of ', 'som tam', '.\n']","The fruits used in this particular salad show the fusion aspect of Thai cuisine, as it incorporates ""modern"" (for Thais) fruit such as apples and grapes besides traditional fruit such as pineapple and guava. The dressing is made with pounded garlic, sugar, chili peppers, dried shrimp, lime juice and fish sauce, and is similar to that of  som tam .",Shared dishes,Salads
25,Tam som-o nam pu,ตำส้มโอน้ำปู,,,North,"['It is a spicy ', 'pomelo', ' salad which uses crab extract as a flavouring. This black sauce is achieved by pounding ', 'pu na', ' (""ricefield crabs"", ', 'Somanniathelphusa', ') to a pulp, straining the juices which are then boiled and reduced until the sauce becomes as thick as molasses.\n']","It is a spicy  pomelo  salad which uses crab extract as a flavouring. This black sauce is achieved by pounding  pu na  (""ricefield crabs"",  Somanniathelphusa ) to a pulp, straining the juices which are then boiled and reduced until the sauce becomes as thick as molasses.",Shared dishes,Salads
26,Yam bai cha,ยำใบชา,,,,"['A spicy Thai salad made with young, fresh tea leaves.\n']","A spicy Thai salad made with young, fresh tea leaves.",Shared dishes,Salads
27,Yam hu mu,ยำหูหมู,,,,"[""It is a salad made with thinly sliced, boiled pig's ears, the version in the image also contained fresh mint, lime juice, shallots, lemon grass, fish sauce and sugar.\n""]","It is a salad made with thinly sliced, boiled pig's ears, the version in the image also contained fresh mint, lime juice, shallots, lemon grass, fish sauce and sugar.",Shared dishes,Salads
28,Yam hua pli thot,ยำหัวปลีทอด,,,,['A spicy Thai yam-style salad with deep-fried slices of banana blossom as its main ingredient.\n'],A spicy Thai yam-style salad with deep-fried slices of banana blossom as its main ingredient.,Shared dishes,Salads
29,Yam hoi khraeng,ยำหอยแครง,,,,"['A spicy Thai salad made with ', 'blood cockles', '.\n']",A spicy Thai salad made with  blood cockles .,Shared dishes,Salads
30,Yam khai dao,ยำไข่ดาว,,,,"['A spicy Thai salad made with fried egg (', 'khai dao', ').\n']",A spicy Thai salad made with fried egg ( khai dao ).,Shared dishes,Salads
31,Yam khamin khao kung,ยำขมิ้นขาวกุ้ง,,,,"['A spicy Thai salad made with finely sliced (', 'au Julienne', ') ""white curcuma"" (probably ', 'Curcuma zedoaria', ""), shredded coconut, cooked prawns, sliced shallots, dried chillies, fresh green bird's eye chili peppers, roasted cashew nuts, and crispy fried onion rings.\n""]","A spicy Thai salad made with finely sliced ( au Julienne ) ""white curcuma"" (probably  Curcuma zedoaria ), shredded coconut, cooked prawns, sliced shallots, dried chillies, fresh green bird's eye chili peppers, roasted cashew nuts, and crispy fried onion rings.",Shared dishes,Salads
32,Yam kun chiang,ยำกุนเชียง,,,,"['A Thai salad made with a sweet dried pork sausage called ', 'kun chiang', '. This sausage is of Chinese origin. This dish is often eaten with plain rice congee (', 'khao tom kui', '; ', 'Thai', ': ', 'ข้าวต้มกุ๊ย', ').\n']",A Thai salad made with a sweet dried pork sausage called  kun chiang . This sausage is of Chinese origin. This dish is often eaten with plain rice congee ( khao tom kui ;  Thai :  ข้าวต้มกุ๊ย ).,Shared dishes,Salads
33,Yam mu krop,ยำหมูกรอบ,,,,"['A Thai salad made with crispy belly pork (', 'mu krop', ').\n']",A Thai salad made with crispy belly pork ( mu krop ).,Shared dishes,Salads
34,Yam mu yo,ยำหมูยอ,,,,"['A spicy yam-style Thai salad with ', 'mu yo', ' (', 'Vietnamese sausage', ').\n']",A spicy yam-style Thai salad with  mu yo  ( Vietnamese sausage ).,Shared dishes,Salads
35,Yam mu yo thot khai dao,ยำหมูยอทอดไข่ดาว,,,,"['A spicy Thai salad made with crispy fried ', 'mu yo', ' (Vietnamese sausage) and ', 'khai dao', ' (fried egg).\n']",A spicy Thai salad made with crispy fried  mu yo  (Vietnamese sausage) and  khai dao  (fried egg).,Shared dishes,Salads
36,Yam naem,ยำแหนมสด,,,,"['A Thai salad containing sausage made from fermented raw pork and sticky rice (', 'naem', ' sausage).\n']",A Thai salad containing sausage made from fermented raw pork and sticky rice ( naem  sausage).,Shared dishes,Salads
37,Yam naem khao khot,ยำแหนมข้าวทอด,Thai croquette salad,,,"['A Thai salad made of crumbled, crispy-fried curried rice balls (similar to a spherical croquette), fermented pork sausage, shallots, green chili peppers or dried chili flakes, peanuts, lime juice, fish sauce, and onion.\n']","A Thai salad made of crumbled, crispy-fried curried rice balls (similar to a spherical croquette), fermented pork sausage, shallots, green chili peppers or dried chili flakes, peanuts, lime juice, fish sauce, and onion.",Shared dishes,Salads
38,Yam no mai,ยำหน่อไม้,,,North,"['A Northern Thai salad made with strips of boiled bamboo shoots, shallots, herbs, fish sauce, lime juice, and chili peppers.\n']","A Northern Thai salad made with strips of boiled bamboo shoots, shallots, herbs, fish sauce, lime juice, and chili peppers.",Shared dishes,Salads
39,Yam no mai sai nam pu,ยำหน่อไม้ใส่น้ำปู,,,North,['A northern Thai salad made with boiled bamboo shoots and a thick paste made from the rice paddy crabs.\n'],A northern Thai salad made with boiled bamboo shoots and a thick paste made from the rice paddy crabs.,Shared dishes,Salads
40,Yam nuea yang,ยำเนื้อย่าง,Thai grilled beef salad,,,"['A spicy salad of grilled beef, shallots, and Thai celery or spearmint.\n']","A spicy salad of grilled beef, shallots, and Thai celery or spearmint.",Shared dishes,Salads
41,Yam phak khut,ยำผักกูด,,,,"['A salad of edible fern shoots (', 'Diplazium esculentum', ') and pork.\n']",A salad of edible fern shoots ( Diplazium esculentum ) and pork.,Shared dishes,Salads
42,Yam pla duk fu,ยำปลาดุกฟู,"""Exploded"" catfish salad",,,"['Crispy fried shredded ', 'pla duk', ' (catfish) served with a spicy and tangy green mango salad.\n']",Crispy fried shredded  pla duk  (catfish) served with a spicy and tangy green mango salad.,Shared dishes,Salads
43,Yam pla khem,ยำปลาเค็ม,,,,"['A Thai salad (', 'yam', ') made with fried sun-dried salted fish (', 'pla khem', ').\n']",A Thai salad ( yam ) made with fried sun-dried salted fish ( pla khem ).,Shared dishes,Salads
44,Yam pla salit,ยำปลาสลิด,,,,"['A Thai salad made with deep-fried, sun-dried snakeskin gourami..\n']","A Thai salad made with deep-fried, sun-dried snakeskin gourami..",Shared dishes,Salads
45,Yam pla thu,ยำปลาทู,,,,"['Made with ', 'short mackerel', ' (', 'pla thu', ').\n']",Made with  short mackerel  ( pla thu ).,Shared dishes,Salads
46,Yam sanat,ยำสะนัด,,,North,"['A northern Thai salad of roughly chopped, blanched vegetables that are then refried with a chilli paste. It is served here together with northern Thai ', 'pork cracklings', ' and deep-fried, sun-dried chili peppers.\n']","A northern Thai salad of roughly chopped, blanched vegetables that are then refried with a chilli paste. It is served here together with northern Thai  pork cracklings  and deep-fried, sun-dried chili peppers.",Shared dishes,Salads
47,Yam som-o,ยำส้มโอ,,,,"[""A salad made with pomelo. The other ingredients are: sliced red bird's eye chili peppers, deep-fried sun-dried anchovies, roasted peanuts, fish sauce and tamarind juice.\n""]","A salad made with pomelo. The other ingredients are: sliced red bird's eye chili peppers, deep-fried sun-dried anchovies, roasted peanuts, fish sauce and tamarind juice.",Shared dishes,Salads
48,Yam takhrai kung sot,ยำตะไคร้กุ้งสด,,,,"['A spicy ""yam-style"" salad with finely sliced raw lemongrass and prawns.\n']","A spicy ""yam-style"" salad with finely sliced raw lemongrass and prawns.",Shared dishes,Salads
49,Yam thale,ยำทะเล,,,,"['A spicy salad with mixed seafood (cuttlefish, shelled prawns, mussels), shallots, lime juice, fish sauce and Thai celery.\n']","A spicy salad with mixed seafood (cuttlefish, shelled prawns, mussels), shallots, lime juice, fish sauce and Thai celery.",Shared dishes,Salads
