X1,Thai_name,Thai_script,English_name,Image,Region,Description,Description2,major_grouping,minor_grouping
3,Mu kratha,หมูกระทะ,,,,"['Mu kratha', ' resembles a combination of a ', 'Korean barbecue', ' and a Chinese ', 'hot pot', '. Meat (most often pork) is grilled in the center while the vegetables and other ingredients, such as ', 'fish balls', ', cook in the soup. It is served with a variety of ', 'nam chim', ' (Thai dipping sauces).\n']","Mu kratha  resembles a combination of a  Korean barbecue  and a Chinese  hot pot . Meat (most often pork) is grilled in the center while the vegetables and other ingredients, such as  fish balls , cook in the soup. It is served with a variety of  nam chim  (Thai dipping sauces).",Individual dishes,Misc Indiv
4,Nam phrik kapi kap pla thu thot,น้ำพริกกะปิกับปลาทูทอด,,,,"['Fried ', 'pla thu', ' served with ', 'nam phrik', ' kapi', ', a pungent dip made mainly from ', 'shrimp paste', ' and chili peppers, and raw, steamed, and/or fried vegetables (often pieces of ', 'cha-om', ' omelette). It is eaten with ', 'khanom chin', ' (Thai rice noodles) or steamed rice. Although the name of this dish is often shortened to ', 'nam phrik pla thu', ', this refers to a certain type of chili paste in which ', 'pla thu', ' is used as an ingredient.\n']","Fried  pla thu  served with  nam phrik  kapi , a pungent dip made mainly from  shrimp paste  and chili peppers, and raw, steamed, and/or fried vegetables (often pieces of  cha-om  omelette). It is eaten with  khanom chin  (Thai rice noodles) or steamed rice. Although the name of this dish is often shortened to  nam phrik pla thu , this refers to a certain type of chili paste in which  pla thu  is used as an ingredient.",Individual dishes,Misc Indiv
5,Pathongko,ปาท่องโก๋,,,,"['The Thai version of the Chinese ', 'crullers', ' called ', 'youtiao', ', they tend to be smaller than the Chinese original. Most often eaten with sweetened condensed milk or with Thai ', 'coconut jam', ', they can also be served with ', 'chok', ', Thai rice ', 'congee', '.\n']","The Thai version of the Chinese  crullers  called  youtiao , they tend to be smaller than the Chinese original. Most often eaten with sweetened condensed milk or with Thai  coconut jam , they can also be served with  chok , Thai rice  congee .",Individual dishes,Misc Indiv
6,Suki,สุกี้,Thai suki,,,"['A Thai variant of the Chinese ', 'hot pot', ', it is mainly eaten as a meal on its own.\n']","A Thai variant of the Chinese  hot pot , it is mainly eaten as a meal on its own.",Individual dishes,Misc Indiv
0,Chin hum,จิ๊นฮุ่ม,,,North,['It is a slowly stewed meat curry from northern Thailand. This particular version is made with beef.\n'],It is a slowly stewed meat curry from northern Thailand. This particular version is made with beef.,Shared dishes,Curries
1,Chuchi pla kaphong,ฉู่ฉี่ปลากะพง,,,Central,"['A semi-dry red curry with fried ', 'Snapper', '.\n']",A semi-dry red curry with fried  Snapper .,Shared dishes,Curries
2,Chuchi pla thu sot,ฉู่ฉี่ปลาทูสด,,,South,"['A semi-dry curry made with fresh (i.e. unsteamed and unsalted) ', 'pla thu', ' (', 'Rastrelliger brachysoma', '). The version in the image was made at a southern Thai restaurant.\n']",A semi-dry curry made with fresh (i.e. unsteamed and unsalted)  pla thu  ( Rastrelliger brachysoma ). The version in the image was made at a southern Thai restaurant.,Shared dishes,Curries
3,Kaeng cha-om,แกงชะอม,,,North,"['A northern ', 'Thai curry', ' with cha-om (the young leaves of the ', 'Acacia pennata', ') and dried fish. This particular version also contained a mix of different types of mushroom.\n']",A northern  Thai curry  with cha-om (the young leaves of the  Acacia pennata ) and dried fish. This particular version also contained a mix of different types of mushroom.,Shared dishes,Curries
4,Kaeng fak sai kai,แกงฟักใส่ไก่,,,North,"['A northern Thai curry made with ', 'winter melon', ' and chicken. It is also known under the name ', 'kaeng fak khio', '.\n']",A northern Thai curry made with  winter melon  and chicken. It is also known under the name  kaeng fak khio .,Shared dishes,Curries
5,Kaeng dok salae,แกงดอกสะแล,,,North,"['A northern Thai curry that is made from the unopened flower buds of the shrub ', 'Broussonetia kurzii', ' (J. D. Hooker) Corner. These flower buds are available in northern Thailand only from mid-February until late March.\n']",A northern Thai curry that is made from the unopened flower buds of the shrub  Broussonetia kurzii  (J. D. Hooker) Corner. These flower buds are available in northern Thailand only from mid-February until late March.,Shared dishes,Curries
6,Kaeng hangle,แกงฮังเล,,,North,"['A Burmese influenced curry of stewed meat (usually pork), peanuts, dried chili peppers and tamarind juice but without coconut milk. Thin strips of fresh ginger are added in before serving.\n']","A Burmese influenced curry of stewed meat (usually pork), peanuts, dried chili peppers and tamarind juice but without coconut milk. Thin strips of fresh ginger are added in before serving.",Shared dishes,Curries
7,Kaeng het,แกงเห็ด,,,North,['A northern Thai curry made with pork and a variety of mushrooms.\n'],A northern Thai curry made with pork and a variety of mushrooms.,Shared dishes,Curries
8,Kaeng ho,แกงโฮะ,,,North,"['A Northern Thai dish where one or more types of curry are refried with glass noodles and other ingredients such as kaffir lime leaves, lemongrass, and bamboo shoots. At least one of the curries used in this recipe should be the Northern Thai pork curry called ', 'kaeng hangle', '.\n']","A Northern Thai dish where one or more types of curry are refried with glass noodles and other ingredients such as kaffir lime leaves, lemongrass, and bamboo shoots. At least one of the curries used in this recipe should be the Northern Thai pork curry called  kaeng hangle .",Shared dishes,Curries
9,Kaeng kari,แกงกะหรี่,Yellow curry,,,"['It is a Thai-Muslim dish which is mostly known in the West as ""Thai yellow curry"". It is of Indian origin and is often made with chicken and potatoes. It can also be made with other meats or seafood.\n']","It is a Thai-Muslim dish which is mostly known in the West as ""Thai yellow curry"". It is of Indian origin and is often made with chicken and potatoes. It can also be made with other meats or seafood.",Shared dishes,Curries
10,Kaeng khae,แกงแค,,,North,"['A spicy curry of herbs, vegetables, ', 'cha-om', ' leaves (a kind of acacia tree), and meat (chicken, water buffalo, pork, or frog meat). It does not contain any coconut milk.\n']","A spicy curry of herbs, vegetables,  cha-om  leaves (a kind of acacia tree), and meat (chicken, water buffalo, pork, or frog meat). It does not contain any coconut milk.",Shared dishes,Curries
11,Kaeng khanun,แกงขนุน,,,North,"['A northern Thai curry made with boiled whole ', 'jackfruit', ', pork, tomatoes, and chopped ', 'chakhan', ' (', 'Piper interruptum', '; ""pepper vine"").\n']","A northern Thai curry made with boiled whole  jackfruit , pork, tomatoes, and chopped  chakhan  ( Piper interruptum ; ""pepper vine"").",Shared dishes,Curries
12,Kaeng khiao wan,แกงเขียวหวาน,Green curry,,Central,"['A coconut curry made with fresh green chili peppers and flavored with Thai basil, usually with chicken (', 'kaeng khiao wan kai', ') or ', 'fish balls', '.\n']","A coconut curry made with fresh green chili peppers and flavored with Thai basil, usually with chicken ( kaeng khiao wan kai ) or  fish balls .",Shared dishes,Curries
13,Kaeng khilek,แกงขี้เหล็ก,,,,"['This creamy curry has as its main ingredient the leaves and flower buds of the ', 'Senna siamea', ' tree (', 'khilek', ' in Thai).\n']",This creamy curry has as its main ingredient the leaves and flower buds of the  Senna siamea  tree ( khilek  in Thai).,Shared dishes,Curries
14,Kaeng khua,แกงคั่ว,,,Central,"['A type of Thai curry which uses a larger amount of turmeric in the paste than is usually the norm. A popular preparation is with prawns and pineapple. This particular version is called ', 'kaeng khua het fang', ' (', 'Thai', ': ', 'แกงคั่วเห็ดฟาง', '): with ', 'straw mushrooms', '.\n']",A type of Thai curry which uses a larger amount of turmeric in the paste than is usually the norm. A popular preparation is with prawns and pineapple. This particular version is called  kaeng khua het fang  ( Thai :  แกงคั่วเห็ดฟาง ): with  straw mushrooms .,Shared dishes,Curries
15,Kaeng khua mu bai chamuang,แกงคั่วหมูใบชะมวง,,,Central,"['A thick central Thai curry with pork and the leaves of ', 'chamuang', ' or ', 'Garcinia', ' cowa', ', a tree related to the ', 'mangosteen', '.\n']","A thick central Thai curry with pork and the leaves of  chamuang  or  Garcinia  cowa , a tree related to the  mangosteen .",Shared dishes,Curries
16,Kaeng kradang,แกงกระด้าง,,,North,"['A pork curry ', 'aspic', ' (jelly) from northern Thailand which is eaten cold.\n']",A pork curry  aspic  (jelly) from northern Thailand which is eaten cold.,Shared dishes,Curries
17,Kaeng lueang,แกงเหลือง,,,South,"['A sour spicy curry that does not contain coconut milk and is yellow in color due to the use of ', 'turmeric', ', often with fish and vegetables, such as ', 'bamboo shoots', ' as in the version in the photo. In southern Thailand it is called ', 'kaeng som', ' but due to it being different from the central Thai ', 'kaeng som', ', it is called ', 'kaeng lueang', ' (""yellow curry"") elsewhere. It should not be confused with what is known as ""', 'yellow curry', '"" outside of Thailand.\n']","A sour spicy curry that does not contain coconut milk and is yellow in color due to the use of  turmeric , often with fish and vegetables, such as  bamboo shoots  as in the version in the photo. In southern Thailand it is called  kaeng som  but due to it being different from the central Thai  kaeng som , it is called  kaeng lueang  (""yellow curry"") elsewhere. It should not be confused with what is known as "" yellow curry "" outside of Thailand.",Shared dishes,Curries
18,Kaeng matsaman,แกงมัสมั่น,Massaman curry,,South,"['A rich, thick curry containing coconut milk, usually of stewed beef or, as in the image, chicken. This curry contains roasted dried spices that are rarely found in other Thai curries. The name ', 'kaeng matsaman', ' means ""Muslim curry"", with the spices believed to have been brought to Thailand by Muslim traders in the 17th century.\n']","A rich, thick curry containing coconut milk, usually of stewed beef or, as in the image, chicken. This curry contains roasted dried spices that are rarely found in other Thai curries. The name  kaeng matsaman  means ""Muslim curry"", with the spices believed to have been brought to Thailand by Muslim traders in the 17th century.",Shared dishes,Curries
19,Kaeng om,แกงอ่อม,,,North,"['A spicy ', 'Lanna', ' ""curry"" with meat, and without any coconut milk. The version shown in the photo is with beef.\n']","A spicy  Lanna  ""curry"" with meat, and without any coconut milk. The version shown in the photo is with beef.",Shared dishes,Curries
20,Kaeng pa,แกงป่า,Jungle curry,,North,"['Traditionally made with ', 'wild boar', ', most often pork or chicken is used nowadays. This curry, as most curries from northern Thailand, does not contain coconut milk.\n']","Traditionally made with  wild boar , most often pork or chicken is used nowadays. This curry, as most curries from northern Thailand, does not contain coconut milk.",Shared dishes,Curries
21,Kaeng phak bung sai pla,แกงผักบุ้งใส่ปลา,,,North,"['A northern Thai curry made with ""', 'morning glory', '"" and catfish.\n']","A northern Thai curry made with "" morning glory "" and catfish.",Shared dishes,Curries
22,Kaeng phak kat cho kraduk mu,แกงผักกาดจอกระดูกหมู,,,North,"['A somewhat spicy soup/curry (', 'kaeng', ') made with cabbage (', 'phak kat cho', ', a variety of ', 'Brassica rapa chinensis', ') and pork ribs (', 'kraduk mu', '). As is usual with Northern Thai ""curries"", it does not contain any coconut milk.\n']","A somewhat spicy soup/curry ( kaeng ) made with cabbage ( phak kat cho , a variety of  Brassica rapa chinensis ) and pork ribs ( kraduk mu ). As is usual with Northern Thai ""curries"", it does not contain any coconut milk.",Shared dishes,Curries
23,Kaeng phak lueat,แกงผักเลือด,,,North,"['A northern Thai curry made with the leaves of the ', 'Ficus virens', '. This version is with pork.\n']",A northern Thai curry made with the leaves of the  Ficus virens . This version is with pork.,Shared dishes,Curries
24,Kaeng phak siangda,แกงผักเซียงดา,,,North,"['A northern Thai curry made with the leaves of the vine ', 'Gymnema', ' inodorum', ' and dried fish. In this particular version, ', 'snakehead fish', ' is used.\n']","A northern Thai curry made with the leaves of the vine  Gymnema  inodorum  and dried fish. In this particular version,  snakehead fish  is used.",Shared dishes,Curries
25,Kaeng phak wan pa,แกงผักหวานป่า,,,North,"['A Northern Thai curry made with the leaves of the woody plant ', 'Melientha', ' suavis', ' Pierre, glass noodles, and dried fish.\n']","A Northern Thai curry made with the leaves of the woody plant  Melientha  suavis  Pierre, glass noodles, and dried fish.",Shared dishes,Curries
26,Kaeng phanaeng,แกงพะแนง,Phanaeng curry,,Central,"['A so-called dry, Indian influenced coconut curry with beef (', 'phanaeng nuea', ', ', 'Thai', ': ', 'พะแนงเนื้อ', '), chicken, pork or seafood such as soft shell crab.\n']","A so-called dry, Indian influenced coconut curry with beef ( phanaeng nuea ,  Thai :  พะแนงเนื้อ ), chicken, pork or seafood such as soft shell crab.",Shared dishes,Curries
27,Kaeng phet,แกงเผ็ด,Red curry,,Central,"['A spicy red curry made with dried chili peppers, containing coconut milk. It can be made with different meats, seafood or tofu, in combination with (several types of) eggplant(s), and sometimes other vegetables. Fresh green peppercorns and Thai basil are often added to enhance the flavor.\n']","A spicy red curry made with dried chili peppers, containing coconut milk. It can be made with different meats, seafood or tofu, in combination with (several types of) eggplant(s), and sometimes other vegetables. Fresh green peppercorns and Thai basil are often added to enhance the flavor.",Shared dishes,Curries
28,Kaeng phet pet yang,แกงเผ็ดเป็ดย่าง,Red curry,,Central,['Red curry with roast duck is the quintessential mix of the Thai (red curry) and Chinese (red roast duck) cuisines. This dish often also contains grapes and/or pineapple.\n'],Red curry with roast duck is the quintessential mix of the Thai (red curry) and Chinese (red roast duck) cuisines. This dish often also contains grapes and/or pineapple.,Shared dishes,Curries
29,Kaeng pli,แกงปลี,,,North,['A northern Thai curry made with chopped banana flower and pork.\n'],A northern Thai curry made with chopped banana flower and pork.,Shared dishes,Curries
30,Kaeng som,แกงส้ม,,,Central,"['A hot and sour Thai curry/soup made with tamarind paste and fish (often ', 'pla chon', ' [""', 'Snakehead fish', '""]). ', 'Kaeng som cha-om thot', ' (', 'Thai', ': ', 'แกงส้มชะอมทอด', ') is a version of the dish which features deep-fried ', 'cha-om', ' (Acacia leaves) as one of its ingredients.\n']","A hot and sour Thai curry/soup made with tamarind paste and fish (often  pla chon  ["" Snakehead fish ""]).  Kaeng som cha-om thot  ( Thai :  แกงส้มชะอมทอด ) is a version of the dish which features deep-fried  cha-om  (Acacia leaves) as one of its ingredients.",Shared dishes,Curries
31,Kaeng tai pla,แกงไตปลา,,,South,"['A thick, spicy vegetable curry made with turmeric, a sauce made from fish innards (', 'tai pla', '), and shrimp paste, containing roasted fish, bamboo shoots, and eggplant.\n']","A thick, spicy vegetable curry made with turmeric, a sauce made from fish innards ( tai pla ), and shrimp paste, containing roasted fish, bamboo shoots, and eggplant.",Shared dishes,Curries
32,Kaeng thepho,แกงเทโพ,,,Central,"['One of the dishes mentioned in the poem of King Rama II on Thai dishes, it is a central Thai curry originally made with the fatty belly part of the ', 'Pangasius', ' Larnaudii', ' (', 'thae pho', '; shark catfish) but now more often belly pork is used as is the case with the version shown in the photo. The other main ingredient in this curry is ', 'phak bung Chin', ' (Chinese ', 'water spinach', ').\n']","One of the dishes mentioned in the poem of King Rama II on Thai dishes, it is a central Thai curry originally made with the fatty belly part of the  Pangasius  Larnaudii  ( thae pho ; shark catfish) but now more often belly pork is used as is the case with the version shown in the photo. The other main ingredient in this curry is  phak bung Chin  (Chinese  water spinach ).",Shared dishes,Curries
33,Kaeng tun,แกงตูน,,,,"['A northern Thai curry made with the stalks of the ', 'Colocasia gigantea', ' and catfish. ', 'Colocasia gigantea', ' is called ', 'tun', ' (', 'Thai', ': ', 'ตูน', ') in the northern Thai language and ', 'khun', ' (', 'Thai', ': ', 'คูน', ') in standard Thai.\n']",A northern Thai curry made with the stalks of the  Colocasia gigantea  and catfish.  Colocasia gigantea  is called  tun  ( Thai :  ตูน ) in the northern Thai language and  khun  ( Thai :  คูน ) in standard Thai.,Shared dishes,Curries
34,Kaeng yot maphrao on sai kai,แกงยอดมะพร้าวอ่อนใส่ไก่,,,North,"['A northern Thai curry made with ""', 'coconut heart', '"" and chicken. The taste of ""coconut heart"" is similar to bamboo shoots but much sweeter.\n']","A northern Thai curry made with "" coconut heart "" and chicken. The taste of ""coconut heart"" is similar to bamboo shoots but much sweeter.",Shared dishes,Curries
35,Kaeng yuak,แกงหยวก,,,North,['A northern Thai curry made with the tender core of the trunk of the banana plant.\n'],A northern Thai curry made with the tender core of the trunk of the banana plant.,Shared dishes,Curries
36,Khua kling,คั่วกลิ้ง,,,South,"['A very spicy, dry fried curry made with chopped meat (usually beef, chicken, pork, or lamb) served with a large amount of shredded fresh kaffir lime leaves.\n']","A very spicy, dry fried curry made with chopped meat (usually beef, chicken, pork, or lamb) served with a large amount of shredded fresh kaffir lime leaves.",Shared dishes,Curries
37,Khua kraduk,คั่วกระดูกหมู,,,South,"['A very spicy and, for Thai standards, ""dry"" curry with pork ribs and it is a Southern Thai speciality.\n']","A very spicy and, for Thai standards, ""dry"" curry with pork ribs and it is a Southern Thai speciality.",Shared dishes,Curries
38,Yam chin kai,ยำจิ๊นไก่,,,North,['A curry dish from Northern Thailand containing chicken. The version in the image also contains sliced banana flower.\n'],A curry dish from Northern Thailand containing chicken. The version in the image also contains sliced banana flower.,Shared dishes,Curries
39,Kaeng ranchuan,แกงรัญจวน,,,Central,"['Kaeng ranchuan', ' is a beef curry and fermented shrimp paste chili sauce, similar to ', 'tom yam', '. It was created by chef in royal households from the leftovers and turned in new dish by combining pieces of meat and leftover sauce especially ', 'nam phrik kapi', '. The most popular of all dip is ', 'nam phrik kapi', ', a very delicious sauce of Thailand because this sauce can be eaten with everything. Many Thai chefs reformed ', 'kaeng ranchuan', ' to restaurants after it was mentioned by culinary authority ML Nueang Ninrat, in a memoir explaining her life during the reign of King Rama V and VI. The people misunderstand about the origin and preparation of ', 'kaeng ranchuan', ' because of famous TV series that do the wrong method of this dish and make people remember that this is the real ', 'kaeng ranchuan', ' preparation method. So, the real ', 'kaeng ranchuan', ' is in ML Ninrat book ""Life in the Palace"" she tells how her grandmother, the princess Sabai Ninrat created this dish. At the end of dinner there was leftovers so she asked her assistant to separate the meat from chili and basil. Then, she mixed it into a broth and added leftover of Nam prhrik kapi, so this is called the real ', 'kaeng ranchuan', '.\n']","Kaeng ranchuan  is a beef curry and fermented shrimp paste chili sauce, similar to  tom yam . It was created by chef in royal households from the leftovers and turned in new dish by combining pieces of meat and leftover sauce especially  nam phrik kapi . The most popular of all dip is  nam phrik kapi , a very delicious sauce of Thailand because this sauce can be eaten with everything. Many Thai chefs reformed  kaeng ranchuan  to restaurants after it was mentioned by culinary authority ML Nueang Ninrat, in a memoir explaining her life during the reign of King Rama V and VI. The people misunderstand about the origin and preparation of  kaeng ranchuan  because of famous TV series that do the wrong method of this dish and make people remember that this is the real  kaeng ranchuan  preparation method. So, the real  kaeng ranchuan  is in ML Ninrat book ""Life in the Palace"" she tells how her grandmother, the princess Sabai Ninrat created this dish. At the end of dinner there was leftovers so she asked her assistant to separate the meat from chili and basil. Then, she mixed it into a broth and added leftover of Nam prhrik kapi, so this is called the real  kaeng ranchuan .",Shared dishes,Curries
0,Kai tun ya chin,ไก่ตุ๋นยาจีน,,,,"['The name literally translates to ""chicken stewed with Chinese medicine"". It contains medicinal herbs, one of them the dried fruit of the ', 'wolfberry', ', a.k.a. goji berries (', 'Thai', ': ', 'เก๋ากี้', '; ', 'kaoki', '). The dish is of Chinese origin.\n']","The name literally translates to ""chicken stewed with Chinese medicine"". It contains medicinal herbs, one of them the dried fruit of the  wolfberry , a.k.a. goji berries ( Thai :  เก๋ากี้ ;  kaoki ). The dish is of Chinese origin.",Shared dishes,Soups
1,Nam sup,น้ำซุป,,,,"['This is a clear broth, usually served together with ', 'khao man kai', ' (chicken rice), ', 'khao mok', ' (Thai ', 'biryani', '), ', 'khao kha mu', ' (pork trotter simmered in soy sauce served with rice), ', 'khao na pet', ' (red roast duck on rice), or ', 'khao mu daeng', ' (', 'red roast pork', ' on rice). The broth can be made from chicken and/or pork, or it can be wholly vegetarian. The version served with duck is usually made from duck bones. It will often contain sliced ', 'hua chai thao', ' (white ', 'radish', '; also known as ', 'phak kat hua', ' in Thai) and ', 'hua chai po khem', ' (a Chinese ingredient of dried and salted chopped turnip). Garlic, ginger, and pepper are often used as additional ingredients. It is most often garnished with fresh coriander leaves and/or spring onion.\n']","This is a clear broth, usually served together with  khao man kai  (chicken rice),  khao mok  (Thai  biryani ),  khao kha mu  (pork trotter simmered in soy sauce served with rice),  khao na pet  (red roast duck on rice), or  khao mu daeng  ( red roast pork  on rice). The broth can be made from chicken and/or pork, or it can be wholly vegetarian. The version served with duck is usually made from duck bones. It will often contain sliced  hua chai thao  (white  radish ; also known as  phak kat hua  in Thai) and  hua chai po khem  (a Chinese ingredient of dried and salted chopped turnip). Garlic, ginger, and pepper are often used as additional ingredients. It is most often garnished with fresh coriander leaves and/or spring onion.",Shared dishes,Soups
2,Tom chuet,แกงจืด,Clear vegetable soup,,,"['A light vegetable, chicken or pork broth with vegetables and celery, to which minced pork, soft tofu, seaweed, ', 'glass noodles', ', and mushroom can be added. This soup can also be called ', 'Kaeng chuet', ' (', 'Thai', ': ', 'แกงจืดวุ้นเส้น', ').\n']","A light vegetable, chicken or pork broth with vegetables and celery, to which minced pork, soft tofu, seaweed,  glass noodles , and mushroom can be added. This soup can also be called  Kaeng chuet  ( Thai :  แกงจืดวุ้นเส้น ).",Shared dishes,Soups
3,Tom kha kai,ต้มข่าไก่,Coconut soup with chicken,,Central,"['A mild to spicy soup with coconut milk, ', 'galangal', ' (', 'kha', ') and chicken. Mushrooms can be added to the chicken or substitute it.\n']","A mild to spicy soup with coconut milk,  galangal  ( kha ) and chicken. Mushrooms can be added to the chicken or substitute it.",Shared dishes,Soups
